<?xml version="1.0" encoding="UTF-8"?>
<xs:schema xmlns:xs="http://www.w3.org/2001/XMLSchema" elementFormDefault="qualified">
  <xs:element name="xmlsource-mapping">
    <xs:complexType>
      <xs:sequence>
        <xs:element ref="class"/>
        <xs:element maxOccurs="unbounded" ref="query"/>
      </xs:sequence>
      <xs:attribute name="package" use="required"/>
    </xs:complexType>
  </xs:element>
  <xs:element name="class">
    <xs:complexType>
      <xs:sequence>
        <xs:element ref="id"/>
      </xs:sequence>
      <xs:attribute name="collection" use="required" type="xs:NCName"/>
      <xs:attribute name="entity" use="required" type="xs:NCName"/>
      <xs:attribute name="name" use="required" type="xs:NCName"/>
    </xs:complexType>
  </xs:element>
  <xs:element name="id">
    <xs:complexType>
      <xs:attribute name="attribute" use="required" type="xs:NCName"/>
      <xs:attribute name="name" use="required" type="xs:NCName"/>
      <xs:attribute name="type" use="required" type="xs:NCName"/>
    </xs:complexType>
  </xs:element>
  <xs:element name="query">
    <xs:complexType mixed="true">
      <xs:attribute name="name" use="required"/>
    </xs:complexType>
  </xs:element>
</xs:schema>
