<?xml version='1.0' encoding='utf-8'?>
<!-- Version: $Id: Role.xml,v 1.4 2007/12/18 19:25:39 tdanard Exp $ -->
<xmlsource-mapping xmlns:xsi="http://www.w3.org/2001/XMLSchema-instance"
	xsi:noNamespaceSchemaLocation="../../../../../schemas/xmlsourcemapping.xsd"
	package="com.corendal.netapps.framework.core.readdatahandlers">
	<class name="DefaultRoleLoadHandler" collection="roles"
		entity="role">
		<id attribute="id" name="Id" type="string" />

	</class>
	<query
		name="com.corendal.netapps.framework.core.readdatabeans.AbstractRole.findByEnabledFlag">
		<![CDATA[for $result in /roles/role[@enabled-flag =
		:enabledFlag] order by $result/@order return $result]]>
	</query>
	<query
		name="com.corendal.netapps.framework.core.readdatabeans.AbstractRole.findEnabledByKeyword">
		<![CDATA[for $result in /roles/role[(name |= :keyword or
		description |= :keyword or comment |= :keyword) and
		(@enabled-flag = "Y")] order by $result/@order return $result]]>
	</query>
		<query
		name="com.corendal.netapps.framework.core.readdatabeans.AbstractRole.findEnabledByAccountStandaloneFlag">
		<![CDATA[for $result in /roles/role[(@account-standalone-flag = :accountStandaloneFlag) and
		(@enabled-flag = "Y")] order by $result/@order return $result]]>
	</query>
	<query
		name="com.corendal.netapps.framework.core.readdatabeans.AbstractRole.findEnabledByGroupStandaloneFlag">
		<![CDATA[for $result in /roles/role[(@group-standalone-flag = :groupStandaloneFlag) and
		(@enabled-flag = "Y")] order by $result/@order return $result]]>
	</query>
	<query
		name="com.corendal.netapps.framework.core.readdatabeans.AbstractRole.findEnabledByLDAPControlStandaloneFlag">
		<![CDATA[for $result in /roles/role[(@ldap-control-standalone-flag = :ldapControlStandaloneFlag) and
		(@enabled-flag = "Y")] order by $result/@order return $result]]>
	</query>
	<query
		name="com.corendal.netapps.framework.core.readdatabeans.AbstractRole.findEnabledByFileStandaloneFlag">
		<![CDATA[for $result in /roles/role[(@file-standalone-flag = :fileStandaloneFlag) and
		(@enabled-flag = "Y")] order by $result/@order return $result]]>
	</query>
</xmlsource-mapping>
